date,meeting,vendor,max_amount,has_file,file_count,file_types,attached_files,resolution_text
20240125,"Regular Meeting, 6:00 p.m.",,418000.0,True,1,PO_FORM,"Attc 8.07 - AF10347.pdf (1,441 KB)","WHEREAS , a notice was published in two (2) newspapers and the Jersey City Board of Education website. Notice of Competitive Contract/RFP was sent to three (3) vendors; and WHEREAS , one (1) response was received and read aloud on Wednesday, December 27, 2023; and WHEREAS , based on the selection criteria of cost, effectiveness, experience, and qualifications, the committee selected Institute for Multi-Sensory Education located at 24800 Denso Drive, Southfield, MI 48033; now BE IT RESOLVED , the"
20240125,"Regular Meeting, 6:00 p.m.",,588510.0,True,2,PO_FORM; PO_FORM,"Attc 8.13_1 - AF10399.pdf (788 KB); Attc 8.13_2 - AF10399.pdf (1,017 KB)","WHEREAS , the Jersey City Public School District is in need of providing (PD23-24-CC15-76) Accelerated Learning High Impact Tutoring; and WHEREAS , a notice was published in two (2) newspapers and the Jersey City Board of Education website. Notice of Competitive Contract/RFP was sent to ninety-three (93) vendors; and WHEREAS , twenty-one (21) response was received and read aloud on Wednesday, December 27, 2023; and WHEREAS , based on the selection criteria of cost, effectiveness, experience, and"
20240125,"Regular Meeting, 6:00 p.m.",,4211292.97,True,1,PO_FORM,"Attc 9.01 - AF10431.pdf (1,194 KB)","WHEREAS , NJAC 6A:14-7.8(b) specifies that there is to be a tuition contract between the sending school district and the receiving school district when service in the pupil's IEP are purchased for educationally handicapped pupils in accordance with applicable status, rules and regulations of the New Jersey Department of Education; now BE IT RESOLVED , the Jersey City Board of Education, upon the recommendation of the Superintendent and Acting School Business Administrator, approves the entrance "
20240125,"Regular Meeting, 6:00 p.m.",,2025906.25,True,1,PO_FORM,Attc 9.02 - AF10463.pdf (779 KB),"WHEREAS , NJAC 6A:14-7.8(b) specifies that there is to be a tuition contract between the sending school district and the receiving school district when service in the pupil's IEP are purchased for educationally handicapped pupils in accordance with applicable status, rules and regulations of the New Jersey Department of Education; now BE IT RESOLVED , the Jersey City Board of Education, upon the recommendation of the Superintendent and Acting School Business Administrator, approves the entrance "
20240125,"Regular Meeting, 6:00 p.m.",,149944.0,True,1,PO_FORM,"Attc 10.19 - AF10483.pdf (1,468 KB)","WHEREAS , the Jersey City Public School District is in need of Stem Education Kits for its after-school C.A.S.P.E.R. programs; and WHEREAS , the notice was published in two (2) newspapers and the Jersey City Board of Education website; one (1) response was received and read aloud on January 4, 2024; now BE IT RESOLVED , the Jersey City Board of Education, upon the recommendation of the Superintendent and Acting School Business Administrator, approve to award the bid contract for (PD23-24-VM-79) "
20240125,"Regular Meeting, 6:00 p.m.",,34272.0,True,1,PO_FORM,Attc 11.01 - AF10479.pdf (882 KB),"WHEREAS , the Jersey City Public Schools is in need of (PD23-24-MD13-78) Pest Control Management Services; and WHEREAS , invitations to bid were to sent six (6) vendors and published in two (2) newspapers and the JCBOE website; three (3) bid responses were received on December 28, 2023; now BE IT RESOLVED , the Jersey City Board of Education, upon the recommendation of the Superintendent and Acting School Business Administrator, approve the contract for (PD23-24-MD13-78) Pest Control Management "
20240229,"Regular Meeting, 6:00 p.m.",,432378.0,True,1,PO_FORM,Attc 8.17 - AF10413.pdf (885 KB),"WHEREAS , the Jersey City Public School District is in need of providing (PD23-24-CC16-81) Professional Development in Dual TESL Certification and Bilingual Endorsement; and WHEREAS , a notice was published in two (2) newspapers and the Jersey City Board of Education website. Notice of Competitive Contract/RFP was sent to three (3) vendors; and WHEREAS , one (1) response was received and read aloud on Wednesday, February 7, 2024; and WHEREAS , based on the selection criteria of cost, effectivene"
20240229,"Regular Meeting, 6:00 p.m.",,134987.29,True,1,PO_FORM,Attc 9.01 - AF10635.pdf (780 KB),"WHEREAS , NJAC 6A:14-7.8(b) specifies that there is to be a tuition contract between the sending school district and the receiving school district when service in the pupil's IEP are purchased for educationally handicapped pupils in accordance with applicable status, rules and regulations of the New Jersey Department of Education; now BE IT RESOLVED , the Jersey City Board of Education, upon the recommendation of the Superintendent and Acting School Business Administrator, approve the entrance i"
20240229,"Regular Meeting, 6:00 p.m.",,2390000.0,True,1,PO_FORM,Attc 9.02 - AF10641.pdf (900 KB),"WHEREAS , Strulowitz & Gargiulo was awarded the OT/PT Services contract (PD23-24-RFP4-4) approved on June 15, 2023 (Resolution 8.07) in the amount of $1,250,000.00; and WHEREAS , due to increase in services, there is a need to increase the contract cap by $1,140,000.00.  All bid hourly rates remain the same.  PO#24-002365 currently has an open balance of $151,009.25; Acct. # 11.000.216.320.323.00.0000 - $988,990.75 remaining needed for increase; now BE IT RESOLVED , the Jersey City Board of Educ"
20240229,"Regular Meeting, 6:00 p.m.",,1534015.0,True,1,PO_FORM,Attc 9.04 - AF10676.pdf (893 KB),"WHEREAS , E.B.S Healthcare Staffing Service Education was awarded the Speech Services contract (PD23-24-RFP5-5) approved on June 15,2023 (Resolution 8.06) in the amount of $700,000.00; and WHEREAS , dues to increase in services there is a need to increase the contract cap by $834,015.00, all bid hourly rates remain the same; now BE IT RESOLVED , the Jersey City Board of Education, upon the recommendation of the Superintendent and Acting School Business Administrator, approves to increase the con"
20240229,"Regular Meeting, 6:00 p.m.",,513411.0,True,1,PO_FORM,Attc 10.14 - AF10604.pdf (912 KB),"WHEREAS , the Jersey City School District is in need of (PD23-24-TD5-82) Transportation To and From Special Education/Bilingual Schools; and WHEREAS , a notice was published in two (2) newspapers and the Jersey City Board of Education Website; notice of bid was sent to forty (40) vendors; twenty-two (22) bids were received and read aloud on Thursday, February 1, 2024; now BE IT RESOLVED , the Jersey City Board of Education, upon the recommendation of the Superintendent and Acting School Business"
20240229,"Regular Meeting, 6:00 p.m.",,27000.0,True,1,PO_FORM,"Attc 10.16 - AF10663.pdf (1,076 KB)","WHEREAS , the Jersey City Public School District is in need of (PD23-24-83) Diplomas and Diploma Covers; and WHEREAS , a notice was published in two (2) newspapers and the Jersey City Board of Education website; Notice of Bid was sent to two (2) vendors; two (2) bids were received and read aloud on Wednesday, February 14, 2024; now BE IT RESOLVED , the Jersey City Board of Education, upon the recommendation of the Superintendent and Acting Business Administrator, award the contract for (PD23-24-"
20240229,"Regular Meeting, 6:00 p.m.",Pennetta Industrial Automation,7261000.0,False,0,,,"BE IT RESOLVED, the Jersey City Board of Education, upon the recommendation of the Superintendent and Acting School Business Administrator, in accordance with N.J.S.A . 18A:21-4 Use of Reserve Accounts and N.J.A.C . 23A:23A-14.1(h)1 Capital Reserve, approve the withdrawal of funds from Capital Reserve, in the amount of $7,261,000.00, to fund the following capital projects: Boiler replacements at Liberty HS, PS#8, PS#16, PS#29 and PS#41, C. Dougherty & Co., Inc., 7 Washington Ave., Paterson, NJ 0"
20240229,"Regular Meeting, 6:00 p.m.",,2074000.0,True,1,PO_FORM,Attc 11.10 - AF10659.pdf (883 KB),"WHEREAS , the Jersey City Public Schools is in need of (PD23-24-MD12-77) Four (4) Sixty (60) Ton Single Package Cooling Units; and WHEREAS , invitations to bid were sent to four (4) vendors and published in two (2) newspapers and the JCBOE website; four (4) response was received and read aloud on Wednesday, February 14, 2024; and WHEREAS , Pennetta Industrial Automation, 17 Industrial Avenue, Little Ferry, New Jersey 07643 was the lowest bidder; now BE IT RESOLVED , the Jersey City Board of Educ"
20240425,"Regular Meeting, 6:00 p.m.",,418000.0,False,0,,,"WHEREAS , a renewal of contract was approved for (PD23-24-CC14-75) Orton Gillingham Certified Training for Teachers K-2 RE-BID, Resolution 8.17 at a Public Meeting held on March 27, 2024 for the fiscal year 2024-2025; and WHEREAS , the District has decided not to renew the contract made to Institute for Multi-Sensory Education for (PD23-24-CC14-75) Orton Gillingham Certified Training for Teachers K-2 RE-BID; now BE IT RESOLVED , the Jersey City Board of Education, upon the recommendation of the "
20240425,"Regular Meeting, 6:00 p.m.",,19500.0,True,1,PO_FORM,"Attc 8.22 - AF10939.pdf (1,475 KB)","WHEREAS , pursuant to N.J.S.A. 18A:18A-42 and based upon the recommendation of the Assistant Superintendent; and WHEREAS , Speranza Theatre, Inc. has offered to renew for year 3 of their contract for (PD22-23-CC8-49) Historical Theatre Camp at a 0% increase for the 2024-2025 school year; now BE IT RESOLVED , the Jersey City Board of Education, upon the recommendation of the Superintendent and Acting School Business Administrator, approves the renewal of the contract for year 3 for the 2024-2025 "
20240425,"Regular Meeting, 6:00 p.m.",,296000.0,True,1,PO_FORM,Attc 8.23 - AF10862.pdf (775 KB),"WHEREAS , pursuant to N.J.S.A. 18A:18A-42 and based upon the recommendation of the Assistant Superintendent; and WHEREAS , Health and Wellness, LLC has offered to renew for year 2 of their contract for (PD23-24-CC9-59 ) Rev. Dr. Ercel Community School (PS#22) Health Clinic & Gladys Cannon Nunery Community School (PS#29) Health Clinic at 0% increase for the 2024-2025 school year; now BE IT RESOLVED , the Jersey City Board of Education, upon the recommendation of the Superintendent and Acting Scho"
20240425,"Regular Meeting, 6:00 p.m.",,35495.0,True,1,PO_FORM,Attc 8.24 - AF10928.pdf (893 KB),"WHEREAS , pursuant to N.J.S.A. 18A:18A-42 and based upon the recommendation of the Assistant Superintendent; and WHEREAS , Team Wilderness has offered to renew for year 3 of their contract for (PD22-23-CC6-46) Outdoor Experience Summer Camp - REBID at 0% increase for the 2024-2025 school year; now BE IT RESOLVED , the Jersey City Board of Education, upon the recommendation of the Superintendent and Acting School Business Administrator, approves the renewal of the contract for year 3 for the 2024"
20240425,"Regular Meeting, 6:00 p.m.",,1176145.0,True,1,PO_FORM,Attc 8.28 - AF11059.pdf (854 KB),"WHEREAS , the Jersey City Public School District is expanding the project (PD23-24-CC15-76) Accelerated Learning High Impact Tutoring which was awarded on December 14, 2023 Resolution 7.03; and WHEREAS , the contract has been expanded to include seven (7) additional schools: P.S.#3, P.S.#5, P.S.#8, P.S.#11, P.S.#28, P.S.#37, and P.S.#38 for the 2023-2024 school year in the amount of $588,000.00; and WHEREAS , Edmentum, is the awarded vendor; now BE IT RESOLVED , the Jersey City Board of Educatio"
20240425,"Regular Meeting, 6:00 p.m.",,45998.85,True,1,PO_FORM,Attc 8.29 - AF11046.pdf (748 KB),"WHEREAS , COR Advantage/HighScope Educational Research Foundation provides the hosting, support and maintenance of annual student licenses proprietary software; and WHEREAS , the hosting, support and maintenance must be renewed annually for continued services; and WHEREAS , this service is exempt from bidding as per 18A:18A-5(19); now BE IT RESOLVED , the Jersey City Board of Education, upon the recommendation of the Superintendent and Acting School Business Administrator, approves the renewal o"
20240425,"Regular Meeting, 6:00 p.m.",,44259.6,True,1,PO_FORM,Attc 10.15 - AF10898.pdf (838 KB),"WHEREAS , the Jersey City Public School District is in need of (PD23-24-88) Purchase of Caps and Gowns; and WHEREAS , a notice was published in two (2) newspapers and the Jersey City Board of Education website; notice of Bid was sent to four (4) vendors; and four (4) bids were received and read aloud on Thursday, March 14, 2024; now BE IT RESOLVED , the Jersey City Board of Education, upon the recommendation of the Superintendent and Acting School Business Administrator, approve the award of a c"
20240425,"Regular Meeting, 6:00 p.m.",,277000.0,True,1,PO_FORM,"Attc 10.16 - AF10801.pdf (1,105 KB)","WHEREAS , ICare 21st Century Initiative, Inc. has offered to renew for year 2 of their contract for (PD23-24-CC8-58) Cisco Certification Network Academy at an 0% increase for the 2024-2025 school year; now BE IT RESOLVED , the Jersey City Board of Education, upon the recommendation of the Superintendent and Acting School Business Administrator, pursuant to N.J.S.A . 18A:18A-42 , approve the renewal of contract for year 2 for the 2024-2025 school year for (PD23-24-CC8-58) Cisco Certification Netw"
20240425,"Regular Meeting, 6:00 p.m.",,15480.0,True,1,PO_FORM,"Attc 10.17 - AF10799.pdf (1,116 KB)","WHEREAS , New Hood Systems Hood Cleaning has offered to renew for year 3 of their contract for (PD22-23-FD13-69) Degreaser and Power Steam Kitchen Ventilation Systems/Repairs/Parts at 0% increase for the 2024-2025 school year; now BE IT RESOLVED , the Jersey City Board of Education, upon the recommendation of the Superintendent and Acting School Business Administrator, pursuant to N.J.S.A . 18A:18A-42 , approve the renewal of the contract for year 3 for the 2024-2025 school year for (PD22-23-FD1"
20240425,"Regular Meeting, 6:00 p.m.",,30000.0,True,1,PO_FORM,"Attc 10.18 - AF10860.pdf (1,112 KB)","WHEREAS , the Jersey City Public Schools District is in need of Equipment Repair Services (Exclusive of Refrigerators and Freezers); and WHEREAS , the District has advertised for Equipment Repair Services (Exclusive of Refrigerators and Freezers) on November 3, 2023 and November 28, 2023, and no bids were received; and WHEREAS , pursuant to N.J.S.A . 18A:18A-5(c) , the District may proceed to obtain pricing without advertising further for bids; and WHEREAS , Malachy Mechanical has submitted a ne"
20240425,"Regular Meeting, 6:00 p.m.",,105697.67,True,1,PO_FORM,Attc 10.20 - AF11085.pdf (971 KB),"WHEREAS, the District is need of a company to host and provide Voice Over Internet Protocol (VOIP) services for its telecommunications system; and WHEREAS, RingCentral, Inc., 20 Davis Drive, Belmont CA, have provided a proposal under the OMNIA Partners National Purchasing Cooperative, Contract #386; and WHEREAS, RingCentral Inc. has previously provided the District Voice Over Internet Protocol (VOIP) services since March of 2021 and their services are satisfactory; now BE IT RESOLVED, the Jersey"
20240522,"Regular Meeting, 6:00 p.m.",Finalsite,39737.0,True,1,PO_FORM,"Attc 8.02 - AF11292.pdf (1,206 KB)","WHEREAS , Finalsite, provides the licenses, support and maintenance of Integrated Communication System proprietary software; and WHEREAS , the licenses, maintenance and support services must be renewed annually for continued services; and WHEREAS , this service is exempt from bidding as per 18A: 18A-5 (19); and WHEREAS , Finalsite has agreed to renew at the contract amount, $39,737.00 for Mass Communication System; now BE IT RESOLVED , the Jersey City Board of Education, upon the recommendation "
20240522,"Regular Meeting, 6:00 p.m.",,48000.0,True,1,PO_FORM,Attc 8.06 - AF10814.pdf (744 KB),"WHEREAS , pursuant to N.J.S.A . 18A:18A-42 and the recommendation of the Assistant Superintendent; and WHEREAS , Educational Arts Team has offered to renew for year 3 of their contract for (PD22-23-CC4-39) Social and Emotional Learning Summer Camp Experience at an 0% increase for the 2024/25 school year; now BE IT RESOLVED , the Jersey City Board of Education, upon the recommendation of the Superintendent and Acting School Business Administrator, approve the renewal of the contract for year 3 fo"
20240522,"Regular Meeting, 6:00 p.m.",Public Consulting Group,150396.0,True,1,PO_FORM,"Attc 9.01 - AF11149.pdf (2,163 KB)","WHEREAS , the Special Education Department requires maintenance and support for the EDPlan (July 1, 2024 thru June 30, 2025); and WHEREAS , hosting, support and maintenance of Proprietary Software is exempt from public advertising pursuant to N.J.S.A . 18A:18A-5(19) ; and WHEREAS , EDPlan provides a simple and consistent way to plan and track student and staff achievement, improve accountability, ensure compliance, facilitate communication and improve collaboration; and WHEREAS , the Public Cons"
20240522,"Regular Meeting, 6:00 p.m.",,812351.17,True,1,PO_FORM,Attc 9.03 - AF11147.pdf (841 KB),"WHEREAS , NJAC 6A:14-7.8(b) specifies that there is to be a tuition contract between the sending school district and the receiving school district when service in the pupil's IEP are purchased for educationally handicapped pupils in accordance with applicable status, rules and regulations of the New Jersey Department of Education; now BE IT RESOLVED , the Jersey City Board of Education upon the recommendation of the Superintendent and the School Business Administrator, approves the entrance into"
20240522,"Regular Meeting, 6:00 p.m.",,547332.0,True,2,PO_FORM; PO_FORM,11106_1_HR.PR Award Report.pdf (338 KB); Attc 10.13 - AF11106.pdf (763 KB),"WHEREAS , the Jersey City Public School District is in need of updating its (PD23-24-CC12-69) web Based Financial (Cloud-Based) and HR Management Systems; and WHEREAS , a notice was published in two (2) newspapers and the Jersey City Board of Education website; responses were received and read aloud on November 9, 2023; and WHEREAS , based on the selection criteria of cost, effectiveness, experience, and qualifications, the committee selected EMS Linq LLC, 2525 Independent Blvd., Wilmington, NC;"
20240522,"Regular Meeting, 6:00 p.m.",,2774730.0,True,1,PO_FORM,Attc 10.15 - AF11183.pdf (772 KB),"WHEREAS , in accordance with N.J.S.A . 18A:18A-42 and upon the recommendation of the Director of Food Services; and WHEREAS , Whitson Culinary Group, 1800 Motor Parkway, Islandia, NY 11749 has offered to renew for year 3 of their contract for (PD22-23-FD12-64) School Pre-Plated Commercial Vended Meals with an 8% increase to the per meal rate for the 2024/25  school year ( increase to the contract cannot exceed the published index rate of 8%); now BE IT RESOLVED , the Jersey City Board of Educati"
20240522,"Regular Meeting, 6:00 p.m.",,61990.0,True,1,PO_FORM,Attc 10.16 - AF11344.pdf (755 KB),"WHEREAS , the Jersey City Public School District is a member of the TIPS-Interlocal Purchasing Cooperative and is permitted to award contracts to vendors pursuant thereto under the authority of N.J.S.A . 52:34-6.2b(3) and LFN 2012-10; and WHEREAS , the Jersey City Public School District intends to participate in the TIPS-Interlocal Purchasing Systems, Contract RFP#210903 for the purpose of purchasing the Point of Sale (POS) and Inventory/Ordering System from Heartland Mosaic School Solutions for"
20240522,"Regular Meeting, 6:00 p.m.",,30000.0,True,1,PO_FORM,"Attc 10.19 - AF10860.pdf (1,112 KB)","WHEREAS , the Jersey City Public Schools District is in need of Equipment Repair Services (Exclusive of Refrigerators and Freezers); and WHEREAS , the District has advertised for Equipment Repair Services (Exclusive of Refrigerators and Freezers) on two occasions, November 3, 2023 and November 28, 2023 and no bids were received; and WHEREAS , pursuant to N.J.S.A . 18A:18A-5(c) , the District may proceed to obtain pricing without advertising further for bids; and WHEREAS , Malachy Mechanical has "
20240522,"Regular Meeting, 6:00 p.m.",,75000.0,True,1,PO_FORM,Attc 11.05 - AF11300.pdf (737 KB),"WHEREAS , the Jersey City Public Schools is in need of (PD24-25-003) Brick & Refractory Services at Various Schools; and WHEREAS , the invitation to bid was published in two (2) newspapers and the Jersey City Board of Education website.  One (1) response was received on May 7, 2024; now BE IT RESOLVED , the Jersey City Board of Education, upon the recommendation of the Superintendent and Acting School Business Administrator, approve the award of a contract for (PD24-25-003) Brick and Refractory "
20240522,"Regular Meeting, 6:00 p.m.",,250000.0,True,1,PO_FORM,Attc 11.06 - AF11301.pdf (743 KB),"WHEREAS , the Jersey City Public Schools is in need of (PD24-25-002) Bituminous Concrete Resurfacing at Various Schools; and WHEREAS , the invitation to bid was published in two (2) newspapers and the Jersey City Board of Education website.  Three (3) responses were received on May 7, 2024; now BE IT RESOLVED , the Jersey City Board of Education, upon the recommendation of the Superintendent and Acting School Business Administrator, approve the award of a contract for (PD24-25-002) Bituminous Co"
20240522,"Regular Meeting, 6:00 p.m.",,1000000.0,True,1,PO_FORM,Attc 11.07 - AF11305.pdf (741 KB),"WHEREAS , the Jersey City Public Schools is in need of (PD# 24-25-013) Plumbing Services at Various Schools; and WHEREAS , the invitation to bid was published in two (2) newspapers and the Jersey City Board of Education website.  Two (2) responses were received on May 8, 2024; now BE IT RESOLVED , the Jersey City Board of Education, upon the recommendation of the Superintendent and Acting School Business Administrator, approve the award of a contract for (PD# 24-25-013) Plumbing Services at Vari"
20240522,"Regular Meeting, 6:00 p.m.",,1250000.0,True,1,PO_FORM,Attc 11.08 - AF11306.pdf (738 KB),"WHEREAS , the Jersey City Public Schools is in need of (PD#24-25-008) Gas, Oil, Electric, Heating, Unit Ventilation and Cooling System Services; and WHEREAS , the invitation to bid was published in two (2) newspapers and the Jersey City Board of Education website.  One (1) response was received on May 7, 2024; now BE IT RESOLVED , the Jersey City Board of Education, upon the recommendation of the Superintendent and Acting School Business Administrator, approve the award of a contract for (PD24-2"
20240522,"Regular Meeting, 6:00 p.m.",,75000.0,True,1,PO_FORM,Attc 11.09 - AF11307.pdf (739 KB),"WHEREAS , the Jersey City Public Schools is in need of (PD24-25-009) Generator Inspection and Repair Service at Various Sites; and WHEREAS , the invitation to bid was published in two (2) newspapers and the Jersey City Board of Education website.  One (1) response was received on May 8, 2024; now BE IT RESOLVED , the Jersey City Board of Education, upon the recommendation of the Superintendent and Acting School Business Administrator, approve the award of a contract for (PD24-25-009) Generator I"
20240522,"Regular Meeting, 6:00 p.m.",,150000.0,True,1,PO_FORM,Attc 11.10 - AF11309.pdf (742 KB),"WHEREAS , the Jersey City Public Schools is in need of (PD24-25-012) Pipefitting Repair Services - Various Sites; and WHEREAS , the invitation to bid was published in two (2) newspapers and the Jersey City Board of Education website.  Two (2) responses were received on May 8, 2024 ; now BE IT RESOLVED , the Jersey City Board of Education, upon the recommendation of the Superintendent and Acting School Business Administrator, approves the award of a contract for (PD24-25-012) Pipefitting Repair S"
20240522,"Regular Meeting, 6:00 p.m.",,600000.0,True,1,PO_FORM,Attc 11.12 - AF11312.pdf (738 KB),"WHEREAS , the Jersey City Public Schools is in need of (PD24-25-014) Systems Equipment Service and Inspection; and WHEREAS , the invitation to bid was published in two (2) newspapers and the Jersey City Board of Education website.  One (1) response was received on May 8, 2024 ; now BE IT RESOLVED , the Jersey City Board of Education, upon the recommendation of the Superintendent and Acting School Business Administrator, approve the award of a contract for (PD24-25-014) Systems Equipment Service "
20240522,"Regular Meeting, 6:00 p.m.",,500000.0,True,1,PO_FORM,Attc 11.13 - AF11313.pdf (825 KB),"WHEREAS , the Jersey City Public Schools is in need of (PD24-25-007) Flooring Repairs at Various Schools; and WHEREAS , the invitation to bid was published in two (2) newspapers and the Jersey City Board of Education website.  One (1) response was received on May 7, 2024; now BE IT RESOLVED , the Jersey City Board of Education, upon the recommendation of the Superintendent and Acting School Business Administrator, approve the award of a contract for (PD24-25-007) Flooring Repairs at Various Scho"
20240522,"Regular Meeting, 6:00 p.m.",,250000.0,True,1,PO_FORM,Attc 11.14 - AF11318.pdf (788 KB),"WHEREAS , the Jersey City Public Schools is in need of (PD24-25-017) Window and Door Glass Replacement Services at Various Sites; and WHEREAS , the invitation to bid were published in two (2) newspapers and the Jersey City Board of Education website. One (1) response was received May 8, 2024 ; now BE IT RESOLVED , the Jersey City Board of Education, upon the recommendation of the Superintendent and Acting School Business Administrator, approve the award of a contract for (PD24-25-017) Window and"
